,Name,Review_score,Review_number,Rank,Sales,,,,
0,Arjen Kroos Men's Jock Strap Briefs Athletic Supporter Sports Jockstraps Underwear,4.5 out of 5 stars,61,#1,51,,,,
1,Casey Kevin Men's Jockstrap Sexy Underwear Athletic Supporter for Male Cotton Jock Strap,4.8 out of 5 stars,55,#2,21,,,,
2,Arjen Kroos Men's Jockstrap Sexy Mesh Jock Strap Athletic Underwear,4.5 out of 5 stars,"4,456",#3,54,,,Average,253.2857143
3,Arjen Kroos Men's Sexy Low Rise Jockstrap Breathable Cotton Underwear,4.3 out of 5 stars,532,#4,31,,,,
4,Arjen Kroos Men's Sexy Low Rise G-Strings Thongs Tagless Underwear,4.2 out of 5 stars,285,#5,187,,,,
5,AIEOE Men's Patent Leather Thongs Sexy G-Strings Hot Jock Strap,4.0 out of 5 stars,66,#6,151,,,,
6,SKYSPER Jockstrap For Men Workout Jock Straps Male Breathable Underwear Athletic Supporter,4.1 out of 5 stars,53,#7,4,,,,
7,sandbank Men閳ユ獨 Brief Ice Silk Sexy Low Rise Body Building Thongs G-Strings Bikini Underwear,4.4 out of 5 stars,265,#8,192,,,,
8,Casey Kevin Sexy Men's Thong Underwear G-String Bulge Pouch Male Underpants,4.6 out of 5 stars,17,#9,5,,,,
9,Arjen Kroos Men's Jockstrap Sports Underwear Athletic Supporter,4.4 out of 5 stars,"1,259",#10,119,,,,
10,Arjen Kroos Men Sexy Mesh Boxer Briefs Stretch Breathable Shorts Hipsters Trunk Underwear,4.3 out of 5 stars,271,#11,42,,,,
11,Bommi Fairy Men's Waiter Cosplay Bow Tie Bodysuit Thong Butler Teddy Costume Funny Novelty Gift,4.2 out of 5 stars,130,#12,702,,,,
12,Arjen Kroos Men's Sexy High Elastic Jockstrap Athletic Jock Strap Underwear,4.4 out of 5 stars,509,#13,208,,,,
13,YuKaiChen Men's Underwear Briefs Soft Microfibre Silky Slips Underpants Low Rise Wide Waistband Multipack,4.3 out of 5 stars,256,#14,0,,,,
14,Anzhee Mankini Borat Thong String for Men Funny UK Sexy Hot Swimming Thong Swimwear V-Strap Swimsuit Joke Secret Gift Birthday Christmas Xmas Fancy Dress Costume for Mens,4.7 out of 5 stars,4,#15,94,,,,
15,"BSHETR Men's Underwear Jockstrap Athletic Supporters, 4-Pack Cotton Low Rise Stretch Multipack Performance Jock Strap",4.6 out of 5 stars,"2,535",#16,214,,,,
16,Casey Kevin Mens Sexy Thong Underwear G Strings Low Rise Male Underpants,4.6 out of 5 stars,9,#17,,,,,
17,Bommi Fairy Men's Panties Lingerie Lace Low Rise Stretchy G-String Bikini Thong Underwear with Garter,3.9 out of 5 stars,32,#18,,,,,
18,SKYSPER Men's Jock Strap 3pcs Athletic Supporter Sports Jockstraps Underwear with Leg Strap,4.3 out of 5 stars,267,#19,,,,,
19,Arjen Kroos Men's Jock Strap Underwear Athletic Supporter Sports Jockstraps Multipack,4.3 out of 5 stars,"1,338",#20,,,,,
20,Arjen Kroos Men's Sexy Lace G-String Thong Underwear Low Rise T-back Bikini Panties,4.3 out of 5 stars,390,#21,,,,,
21,Arjen Kroos Men's Jockstrap Underwear Sexy Mesh Jock Strap Cotton Athletic Supporters,4.6 out of 5 stars,62,#22,,,,,
22,KHUFUZI Men's 2 Colors Pack Sexy G-Strings Thong Ice Waistband Underwear Bikini Gift For Boyfriend,4.2 out of 5 stars,22,#23,,,,,
23,Arjen Kroos Men's Camouflage Thongs Sexy Low Rise G-Strings Underwear,4.3 out of 5 stars,171,#24,,,,,
24,Casey Kevin Sexy Mens Jockstrap Underwear Breathable Athletic Supporter Male Jock Strap,4.8 out of 5 stars,55,#25,,,,,
25,"WLLWOO Men's Thongs Underwear, Low Rise Stretch Sexy Mesh G-String Quick Dry Jockstrap Athletic Supporters Multipack",4.4 out of 5 stars,"1,518",#26,,,,,
26,Arjen Kroos Men's Sexy Jock Strap Cotton Sport Underwear,3.9 out of 5 stars,282,#27,,,,,
27,Casey Kevin Sexy Mens Jockstrap Underwear Breathable Athletic Supporter for Male Jock Strap,4.8 out of 5 stars,14,#28,,,,,
28,sandbank Men閳ユ獨 Sexy Lingerie Bulge Pouch Bikini Thong G-String Underwear Panties,4.2 out of 5 stars,150,#29,,,,,
29,Kiniki Men's Newton G-String Underwear,3.7 out of 5 stars,25,#30,,,,,
