,Name,Review_score,Review_number,Rank,Score,Types,Number,Ranking Score
0,Triumph Doreen X Bra,4.4 out of 5 stars,"6,139",1,88,Push-up,17,663
1,"SIMIYA Super Comfort Bra, Womens Sports Bras Removable Pads Plus Size Sleep Bras for Girls in Yoga Bralette Leisure Stretch Crop Tops Vest",4.2 out of 5 stars,"13,727",2,87,Stick-on,10,
2,"Women's Invisible Strapless Bras, Reusable Stick On Bra Skin-Friendly Sticky Push Up Bra Adhesive Bra for Party, Bar, Wedding, Beach, and Everyday Wearing Backless Bra for Women",4.2 out of 5 stars,29,3,86,Strapless,13,
3,HOFISH 3PACK Full Bust Seamless Nursing Maternity Bras Bralette S-XXL with Extra Bra Extenders & Clips,4.5 out of 5 stars,"48,042",4,85,Maternity,10,
4,Lemef 3-Pack Seamless Sports Bra Wirefree Yoga Bra with Removable Pads for Women,4.3 out of 5 stars,"18,919",5,84,Minimizers,3,
5,Duufin 5 Pieces Bralette Lace Padded Bralette Lace Bandeau Bra Tube Bra Lace Top with Straps and Removable Pads for Women Girls,3.8 out of 5 stars,"29,281",6,83,Sports,22,
6,"CatoFree Push Up Invisible Bra for Women, 2 Pack Reusable Backless Strapless Sticky Adhesive Bra for Evening Dress",4.4 out of 5 stars,243,7,82,Padded,26,
7,Litthing Women Sports Bra Seamless Comfortable Soft Breathable Ladies Lace Bras Removable Padded Tops Push up Underwear Packs for Yoga Fitness Exercise,4.3 out of 5 stars,"13,261",8,81,Bandeau,4,
8,BQTQ 5 Pieces Camisole Bras for Women V Neck Camisole Bralettes Seamless Sleeping Bra with Straps and Removable Pads for Women Girls,4.4 out of 5 stars,"18,193",9,80,Bralette,14,
9,Blu Apparel Multipack Seamless Comfort Bras for Everyday Wear Non Padded No Underwire Maternity Sleep Bra,4.2 out of 5 stars,"4,113",10,79,Plunge,5,
10,Ayigedu Ladies Plus Size Bra Minimiser Lace Full Coverage Firm Hold Non Padded Non Wired,4.2 out of 5 stars,"1,196",11,78,Racerback,5,
11,UtopyaUK 3 6 9 Pack Comfort Bra Women Girls Crop Top Seamless Bra Sleep Yoga Bralette Stretch Bras Sports Vest Wireless Post Surgery Bra Wire Free,4.3 out of 5 stars,"4,493",12,77,seamless,20,
12,Gemm Front Fastening Bras for Women Non Wired Post Surgery Soft Cotton Lycra Bra,4.1 out of 5 stars,309,13,76,,,
13,Champion Women's Shock Absorber S5044 Ultimate Run Bra Sports Bra,4.3 out of 5 stars,"4,094",14,75,,,
14,MELENECA Women's Front Fastening Racerback Plus Size Stretch Lace Underwire Unlined Bras,4.1 out of 5 stars,"3,721",15,74,,,
15,"CatoFree Invisible Strapless Backless Bra for Women, 2 Pack Stick on Bra Reusable Sticky Push up Bra Adhesive Bra with Skin-Friendly Adhesive for Party, Bar, Wedding, Beach, Everyday Wearing",4.1 out of 5 stars,245,16,73,,,
16,NIKE Women's Swoosh Bra Non Pad Sports Bra,4.4 out of 5 stars,"4,077",17,72,,,
17,Calvin Klein Underwear Women Triangle Bra - Modern Cotton,4.6 out of 5 stars,"1,212",18,71,,,
18,"Geyoga 4 Pieces Strapless Bandeau Bra, Seamless Bralettes Stretchy Non-Padded Bandeau Tube Top Bra for Women",4.0 out of 5 stars,"7,502",19,70,,,
19,Bafully Invisible Adhesive Strapless Bra 2 Pack Sticky Push Up Silicone Bra with Drawstring for Women A to E Cup,3.4 out of 5 stars,"1,589",20,69,,,
20,Fantasie Women's Fusion Underwire Full Coverage Side Support Bra,4.5 out of 5 stars,"1,099",21,68,,,
21,"CatoFree Push Up Invisible Bra, Backless Strapless Sticky Adhesive Bra for Women",4.4 out of 5 stars,303,22,67,,,
22,Triumph Women's Delicate Doreen Non-Wired Everyday Bra,4.3 out of 5 stars,"2,339",23,66,,,
23,Litthing Women Sports Bra Seamless Comfort Bras Padded Ladies Tops Adjustable Strap Bralettes Vest Style Athletic Wireless Wrap Chest Crop Top for Yoga Fitness Exercise,4.3 out of 5 stars,"7,969",24,65,,,
24,Fantasie Speciality Full Cup Bra,4.5 out of 5 stars,"1,411",25,64,,,
25,Vinfact Nursing Bra 3 Pack Seamless V Neck Maternity Bra Women Pregnancy Breastfeeding Bra,4.3 out of 5 stars,"3,083",26,63,,,
26,SYROKAN Women's Comfort Sports Bra High Impact for Large Breasts Wireless Stretch Support Bounce Control,4.2 out of 5 stars,"14,667",27,62,,,
27,sloggi Women's Double Comfort Crop Top. A classic top made from extra-soft cotton for breathability and comfort,4.3 out of 5 stars,"3,513",28,61,,,
28,SYROKAN Women's Full Support Racerback Lightly Lined Underwire Sports Bra,4.3 out of 5 stars,"17,470",29,60,,,
29,WingsLove Women's Full Cup Minimizer Bra Wide Straps Non-Wired No Padding Bra Comfort Plus Size,4.2 out of 5 stars,"16,245",30,59,,,
30,HBselect 3 Pack Women鈥檚 Nursing Bra Wireless Seamless Maternity Bra Breastfeeding Bras Bralette with Removable Bra Pads Extenders,4.3 out of 5 stars,"4,544",31,58,,,
31,Sloggi Women's Zero Feel Top Ex Bustier,4.4 out of 5 stars,"12,505",32,57,,,
32,Duufin 6 Pieces Lace Bra Padded Bralette Bandeau Bra Straps Tube Bra with Removable Pads for Women Girls,3.9 out of 5 stars,"3,083",33,56,,,
33,DotVol Women's Deep Plunge Bra Convertible Push up Low Cut Seamless U Bra,3.8 out of 5 stars,"11,749",34,55,,,
34,Iris & Lilly Women's Microfibre Strapless Bra,4.2 out of 5 stars,227,35,54,,,
35,"SHINYMOD Strapless Bra, Adhesive Silicone Invisible Backless Push Up Sexy Bra Sticky Reusable Skin Friendly Comfortable Cup Bra & 2Pcs Nipple Covers Padded Bra for Swimsuit Women",4.2 out of 5 stars,"4,785",36,53,,,
36,SIMIYA Women Seamless Sports Bra 2 Pack Wireless Compression Bra Without Pading Comfort Yoga Crop Tops Vest for Running Sports Fitness,3.8 out of 5 stars,"1,531",37,52,,,
37,Delimira Women's Front Fastening Bras Full Cup Non Wired Back Support Posture Bra,4.2 out of 5 stars,788,38,51,,,
38,AoToZan 2 Front Zip Sport Bras with Removable Pads for Women Running Shirt Yoga Tank Top,3.7 out of 5 stars,"24,382",39,50,,,
39,ANGOOL Padded Sports Bra Wirefree Mid Impact Yoga Bras Unique Cross Back Strappy for Gym Yoga,3.8 out of 5 stars,365,40,49,,,
40,"HETOO Push Up Sticky Bras for Women, Backless Invisible Bra Adhesive Bra Breast Lift Tape Reusable Nipple Covers",4.3 out of 5 stars,"4,719",41,48,,,
41,YIANNA Women High Impact Sports Bra Plus Size Zip Front Fastening Bras Padded Adjustable Strap,3.3 out of 5 stars,9,42,47,,,
42,4 Pieces V Neck Bralettes Wireless Cami Bra Tank Top Bra Sports Bra for Women Girls,3.9 out of 5 stars,"2,054",43,46,,,
43,"Aigori Nursing Bras Pack of 2, Seamless Wirefree Maternity Bra for Motherhood Pregnancy Breastfeeding Sleeping with Extenders (Ship from UK)",4.2 out of 5 stars,"14,899",44,45,,,
44,SYROKAN Women's Sports Bra High Impact Front Fastening Zipper Wireless Post Surgery Support Workout Bra,4.3 out of 5 stars,"1,095",45,44,,,
45,Wonderbra Women's Ultimate Strapless Everyday Bra,3.9 out of 5 stars,"10,183",46,43,,,
46,Triumph Women's Wired Padded Bra,4.2 out of 5 stars,"2,145",47,42,,,
47,Ayigedu UK Women's Plus Size Bra Full Coverage Non-Wired Non-Padded Minimizer Cotton Bra,4.4 out of 5 stars,"1,674",48,41,,,
48,Boao 3 Pieces Women's Floral Lace Tube Top Bra Bandeau Strapless Bras Seamless Stretchy Chest Wrap,4.2 out of 5 stars,232,49,40,,,
49,WingsLove Push Up Bra Sexy Deep V Plunge Add 2 Cups Bras Underwire T-Shirt Bra Multiway,3.7 out of 5 stars,"15,802",50,39,,,
50,Fantasie 6000 6001 Belle Underwired Non Padded Full Cup Supportive Lace Bra,4.3 out of 5 stars,"3,310",51,38,,,
51,DOBREVA Women's Push Up Bra Front Fastening Lace Padded Plunge Underwired Racer Back Bras,4.6 out of 5 stars,"1,019",52,37,,,
52,"KLKIT 3 Pack Women鈥檚 Nursing Bra, Seamless Maternity Bra, Breastfeeding Bras with Removable Spill Prevention Bra Pads & Extra Bra Extenders & Clips",4.2 out of 5 stars,"8,230",53,36,,,
53,DotVol Non Padded Plus Size Everyday Bra Women's Full Coverage Minimizer Bra Comfort Lace Wirefree,3.9 out of 5 stars,445,54,35,,,
54,"Donbafre Push Up Bra for Women, 2 Pack Invisible Adhesive Strapless Backless Bra, Stick on Bra with Drawstring, Reusable & Skin Friendly Sticky Silicone Padded for Everyday Wearing, Party, Wedding",4.3 out of 5 stars,"1,027",55,34,,,
55,INTLMATE 3 Pack Women's Nursing Bra Seamless Wireless Night Sleep Nursing Maternity Bra Sleep Bralette with Removable Spill Prevention Pads and Bra Extenders,3.8 out of 5 stars,25,56,33,,,
56,WingsLove Women鈥檚 Floral Lace Bra Underwire Non Padded Soft Cup Full Coverage,4.4 out of 5 stars,153,57,32,,,
57,Curvy Kate Women Victory Balcony Everyday Bra,4.4 out of 5 stars,934,58,31,,,
58,FM London Women's Padded Lace Push-up Bra,4.0 out of 5 stars,"1,423",59,30,,,
59,Vivisence Eve 1012 Underwired Push-Up Padded Bra Removable Silicone Straps Backless - Made in EU,3.8 out of 5 stars,"3,826",60,29,,,
60,OMKAGI Women Workout Sports Bras Criss Cross Padded Support Yoga Bra Fitness Crop Tank Tops,3.7 out of 5 stars,"5,318",61,28,,,
61,Niidor Adhesive Bra Sticky Bra Wing-Shape Reusable Strapless Backless Bra Invisible Push up Silicone Bra for Women,4.2 out of 5 stars,20,62,27,,,
62,Lemef Nursing Sleep Bras Wirefree Maternity Breastfeeding Bras 3 Pack,3.8 out of 5 stars,"1,815",63,26,,,
63,Wonderbra Women's Ultimate Plunge Underwired Multiway,4.1 out of 5 stars,"3,318",64,25,,,
64,Sloggi Women's Body Adapt Bralette Bra,3.8 out of 5 stars,"2,126",65,24,,,
65,CRZ YOGA Women's Medium Support Sports Bra Strappy Back Wirefree Removable Cups Longline Yoga Crop Top Bra,3.9 out of 5 stars,343,66,23,,,
66,Bafully Invisible Adhesive Strapless Bra Sticky Push Up Silicone Bra with Nipple Covers for Women Backless Dress,4.1 out of 5 stars,277,67,22,,,
67,DORINA Women's Bra Lianne,4.3 out of 5 stars,"10,539",68,21,,,
68,Springcmy Women Hands Free Breast Pump Breast Feeding Pump Pumping Maternity Nursing Bra,2.8 out of 5 stars,327,69,20,,,
69,O-WareBaby Maternity Nursing Bra Seamless Breastfeeding Bras for Women 3 Pack S-XXL,4.3 out of 5 stars,336,70,19,,,
70,JOJOANS 3/4 Pack Bra Bralette Ultimate Comfort Bra Padded Seamless Plus Size Light Support Sports Bra for Yoga Stretch Wireless Leisure Underwear,4.3 out of 5 stars,590,71,18,,,
71,MELENECA Front Fastening Bras for Women Plus Size Underwire Unlined Lace Cup Cushion Strap,4.2 out of 5 stars,273,72,17,,,
72,Eden House | Ladies | Cotton Lace Front Fastening Magic Bra |,4.3 out of 5 stars,"3,254",73,16,,,
73,CLOUSPO Sports Bra Post Surgery Bra Zip Front Wireless with Removable Pads Yoga Bra for Workout Fitness,4.1 out of 5 stars,"2,476",74,15,,,
74,Boody | Women's Shaper Bra | Organic Bamboo Underwear | Seamless Bra | 1 Pack,4.0 out of 5 stars,994,75,14,,,
75,MIERSIDE Women's Plus Size Lace Seduction Underwire Molded Demi Bra,4.0 out of 5 stars,"2,468",76,13,,,
76,"ANGOOL Sports Bras for Women, Racerback Yoga Bra Padded Mid Impact Support for Workout Fitness",4.1 out of 5 stars,"3,801",77,12,,,
77,Under Armour Mid Keyhole Light & Breathable Running Bra Women,4.2 out of 5 stars,"3,595",78,11,,,
78,frugue Non Wired Comfort Wireless Support Bra,4.3 out of 5 stars,"9,684",79,10,,,
79,seagallery Low Back Bras for Women Push Up Deep V Neck Plunge Backless Bra Multiway Strap Convertible Bra Wire Lifting Bra,4.4 out of 5 stars,"6,794",80,9,,,
80,WingsLove Women's Sports Bra Full Coverage High Impact Wirefree Workout Non Padded Shock Absorber Ultimate Run Bra Plus Size,4.0 out of 5 stars,"3,305",81,8,,,
81,Calvin Klein Women's Unlined Bralette Bra,2.9 out of 5 stars,20,82,7,,,
82,YIANNA Women Sports Bra Padded Elastic Breathable Wireless High Impact Yoga Bras Top,4.1 out of 5 stars,"8,334",83,6,,,
83,SHAPERX Women Shapewear Tummy Control Fajas Colombianas Full Body Shaper Butt Lifter Thigh Slimmer Shorts,4.7 out of 5 stars,422,84,5,,,
84,Delimira Women's Front Fastening Bras Lace Plus Size Full Coverage Racerback Wireless,4.3 out of 5 stars,"4,993",85,4,,,
85,Delimira Women's Minimiser Bra Seamless Plus Size Non Padded Underwired Bras,4.0 out of 5 stars,"1,271",86,3,,,
86,DODOING Zip Front Sports Bra Post Surgery Bra Yoga Bra Workout Fitness Activewear Racerback Padded Bras for Women,3.7 out of 5 stars,"8,493",87,2,,,
87,Sloggi Women's Romance Si Bra,4.2 out of 5 stars,"3,002",88,1,,,
